{"$defs":{"contract":{"additionalProperties":false,"properties":{"contract":{"minLength":1,"type":"string"},"sha256":{"$ref":"#/$defs/digest"}},"required":["contract","sha256"],"type":"object"},"digest":{"pattern":"^[0-9a-f]{64}$","type":"string"},"workflow":{"additionalProperties":false,"properties":{"contract":{"minLength":1,"type":"string"},"gates":{"items":{"type":"string"},"type":"array","uniqueItems":true},"metadata_scope":{"const":"workflow-specific"},"review_scopes":{"items":{"type":"string"},"type":"array","uniqueItems":true},"sha256":{"$ref":"#/$defs/digest"},"stages":{"items":{"type":"string"},"type":"array","uniqueItems":true}},"required":["metadata_scope","stages","gates","review_scopes","contract","sha256"],"type":"object"}},"$id":"kapisch://schemas/v3/bundle","$schema":"https://json-schema.org/draft/2020-12/schema","additionalProperties":false,"anyOf":[{"not":{"anyOf":[{"required":["review_contract"]},{"required":["review_schema_variant"]}]}},{"required":["review_contract","review_schema_variant"]}],"properties":{"authority_contract":{"const":"global-authority/1"},"controller_instructions":{"minLength":1,"type":"string"},"policies":{"additionalProperties":false,"properties":{"authority":{"$ref":"#/$defs/contract"},"dispatch":{"$ref":"#/$defs/contract"},"handoff":{"$ref":"#/$defs/contract"},"normalization":{"$ref":"#/$defs/contract"},"resume":{"$ref":"#/$defs/contract"},"review":{"$ref":"#/$defs/contract"},"risk":{"$ref":"#/$defs/contract"}},"required":["authority","dispatch","handoff","normalization","resume","review","risk"],"type":"object"},"protocol_version":{"const":3},"review_contract":{"const":"review-evidence/1"},"review_schema_variant":{"const":"review-invocation/1"},"stage_evidence_contract":{"const":"stage-evidence/1"},"roles":{"additionalProperties":false,"properties":{"architect":{"$ref":"#/$defs/contract"},"implementer":{"$ref":"#/$defs/contract"},"implementer-lite":{"$ref":"#/$defs/contract"},"mechanic":{"$ref":"#/$defs/contract"},"researcher":{"$ref":"#/$defs/contract"},"reviewer":{"$ref":"#/$defs/contract"}},"required":["architect","implementer","implementer-lite","mechanic","researcher","reviewer"],"type":"object"},"schemas":{"additionalProperties":false,"properties":{"approval":{"type":"object"},"bundle":{"type":"object"},"human-action":{"type":"object"},"invocation":{"type":"object"},"repository-state":{"type":"object"},"run":{"type":"object"},"scope":{"type":"object"},"snapshot":{"type":"object"},"stage":{"type":"object"}},"required":["approval","bundle","invocation","repository-state","run","snapshot","stage","human-action","scope"],"type":"object"},"vocabulary":{"additionalProperties":false,"properties":{"capability_effects":{"items":{"type":"string"},"type":"array"},"execution_classes":{"items":{"type":"string"},"type":"array"},"gates":{"items":{"type":"string"},"type":"array"},"logical_tiers":{"items":{"type":"string"},"type":"array"},"review_depths":{"items":{"type":"string"},"type":"array"},"review_scopes":{"items":{"type":"string"},"type":"array"},"risks":{"items":{"type":"string"},"type":"array"},"roles":{"items":{"type":"string"},"type":"array"},"stages":{"items":{"type":"string"},"type":"array"},"transitions":{"items":{"type":"string"},"type":"array"},"workflows":{"items":{"type":"string"},"type":"array"}},"required":["capability_effects","execution_classes","gates","logical_tiers","review_depths","review_scopes","risks","roles","stages","transitions","workflows"],"type":"object"},"workflows":{"additionalProperties":false,"properties":{"advisory":{"$ref":"#/$defs/workflow"},"milestone":{"$ref":"#/$defs/workflow"},"review":{"$ref":"#/$defs/workflow"},"task":{"$ref":"#/$defs/workflow"}},"required":["advisory","milestone","review","task"],"type":"object"}},"required":["protocol_version","vocabulary","roles","workflows","policies","controller_instructions","schemas","authority_contract"],"title":"CoreBundle v3","type":"object"}
