{"authority_contract":"global-authority/1","controller_instructions":"# Controller instructions\n\nInterpret user intent, explicit controls, governing repository instructions, and current repository evidence. Choose a declared workflow and bounded scope; identify applicable active decisions and disclose unresolved human choices. English interpretation and readiness judgment remain controller responsibilities, not deterministic validator claims.\n\nUse role contracts and shared policies as the sole semantic authority. Workflow metadata marks workflow-specific stages, gates, and review scopes; it is not the complete admissible set, a mandatory sequence, or a lifecycle matrix. `evaluate_action_policy()` alone decides static admissibility, and build/test checks keep declarations consistent with that policy. Adapters may supply runtime settings and factual capability observations, but neither profile names nor model/provider identity changes role, tier, risk, authority, or gate requirements. Unknown capabilities are not enforced capabilities.\n\nThe human owns explicit decision input and side-effect permission, separately from independent reviewer judgment; the host adapter owns factual inbound-action and invocation observations; workers, reviewers, and delegates own their returned reports, judgments, and results. The controller owns run state, assignments, immutable snapshot serialization after explicit human choice, approved-plan bindings, and references to persisted evidence. It transports and persists externally owned facts without claiming to produce them. Each consumed durable artifact must have an earlier explicit producer, and each authority field exactly one owner. Persist immutable evidence before publishing state that references it. A cold restart must recover from validated persisted authority alone, never conversational memory or caller assertions.\n\nBefore any authoritative approval, readiness, or resumable execution claim, invoke the conformant validator against the exact retained bundle and current repository evidence. Findings-only review and non-authoritative research may omit validation. Validator success is necessary but does not itself prove human intent, independent judgment, causality, or readiness.\n\nRenderer-produced views and optional telemetry are disposable observations, never gate inputs. Never resume v2 state as v3, silently fall back across protocols, or treat telemetry/controller views as authority. When required evidence, capability, or safe reconciliation is unavailable, block and state what is missing.\n","policies":{"authority":{"contract":"# Human authority and retained semantics\n\n## Legacy retained runs\n\nA retained run using the legacy authority contract remains interpretable only under the exact retained `CoreBundle` bytes and digest that governed that run. `global-authority/1` and later code do not reinterpret legacy `accepted_snapshot` data under newer semantics. Legacy evidence remains valid only for the legacy contract that produced it.\n\n## Global authority boundaries\n\n`HumanActionClaim` preserves host-observed action and anti-replay ownership facts. It is evidence, not a human decision, reviewer approval, side-effect permission, or repository authority.\n\n`GateApprovalRecord` is the durable record of explicit human approval for one complete `GateApprovalPayload`. It binds run, gate, identity, scope, subject, and evidence. It does not itself commit repository authority.\n\n`AcceptanceRecord` is the only global repository-authority commit. A repository-decision `GateApprovalRecord` remains an approval record until a separate consumer revalidates it and publishes the corresponding `AcceptanceRecord`; never infer repository authority from a GateApproval alone. Acceptance preserves governing-source dependencies and amendment/supersession edges. Human acceptance cannot override an active normative source.\n\nFor plan approval, Stage 5.5 persists a closed immutable `PlanApprovalCandidate` before the human gate. It binds exact plan identity/reference/bytes digest, persisted scope reference, one exact retained CoreBundle digest, complete `AuthorityBinding` set, and execution binding (`graph-free` or exact existing milestone graph and node-scope refs; graph bytes alone own dependency edges). Candidate bytes are content-addressed under `.kapisch/v3/authority/plan-approval-candidates/`. Run state stores its exact `{path, sha256}` as non-authoritative `plan_candidate_ref`; the plan-approval `GateApprovalPayload.subject` binds that exact reference/digest. Neither anchor nor candidate alone approves a plan.\n\nPublication order is: retain plan and supporting immutable artifacts; publish candidate; persist candidate reference; construct/hash payload; retain human evidence; publish `HumanActionClaim` if receipt-backed; publish immutable `GateApprovalRecord`; only then write/repair `PlanRef`. The GateApprovalRecord is the human-approval commit; `PlanRef` is only a repairable backlink. Cold recovery follows the exact candidate reference and never selects by `(run_id, plan_id)`, mutable current state, record order, or bundle discovery.\n\nHistorical plan-approval loading validates only the immutable candidate, exact retained plan/scope/bundle/authority/artifact references and human evidence; it does not require mutable current run scope, graph, node scopes or authority. Promotion independently reloads current scope, graph/node scopes/dependencies, plan bytes, authority and source freshness; historical validity alone never authorizes work. Producer-run loss cannot redirect the bundle or artifact selection. Stage 5.3a does not retain candidate plan bytes, publish or load plan approvals, or publish `PlanRef`; Stage 5.5 owns plan-byte retention, approval, and promotion. Side-effect permission is a separate gate and remains unsupported before its request producer exists.\n\n## Human evidence and external artifact retention\n\nA host-action approval references a retained `HumanActionClaim`; repeating receipt fields in a controller-owned envelope cannot substitute for the host-observed action. A receipt records observable origin, not cryptographic identity.\n\nExternal approval input must be an `ExternalArtifactInput` marked `EXTERNALLY_SUPPLIED`. Core validates its exact canonical bytes against the complete `GateApprovalTarget` before retaining them. Core derives the immutable path `.kapisch/v3/authority/human-artifacts/<sha256>.json`; caller reference is never a repository path. `GateApprovalRecord` stores the derived path and digest. Exact read-back and digest comparison are required; a same-path byte collision, tamper, missing artifact, or uncertain write that cannot be resolved by exact read-back fails closed. An orphan artifact grants no approval or authority. A digest binds bytes, not authorship; do not claim stronger guarantees.\n\n## Historical validity versus current eligibility\n\nLoading a retained approval establishes its historical schema, target, and evidence bindings. It does not establish that the approval is currently governing, fresh, or eligible for promotion or execution. Consumers must re-evaluate current governing sources and freshness; changed dependencies stale downstream use until re-evaluation and a fresh human decision. Historical GateApproval and Acceptance records remain immutable.\n\n## Reviewer approval\n\nIn the legacy protocol, `Gate.HUMAN_DECISION` records explicit human choice, `Gate.APPROVAL` records independent reviewer approval, and `Gate.SIDE_EFFECT` records separate human permission for an authorized effect. Explicit human approval of a plan is a `Gate.HUMAN_DECISION` bound to that plan, not a consequence of `Gate.APPROVAL` reviewer judgment.\n\nReviewer judgment is separate from explicit human decisions and side-effect permission. A reviewer approval neither supplies nor implies a second human approval. The reviewer owns review judgment; the adapter owns observed invocation facts; the controller binds, but never authors, those external facts.\n","sha256":"b57317b68c8a46fc06b139d9caf9cb51371977081744952da3ebe6ebc8c8f44f"},"dispatch":{"contract":"# Dispatch policy\n\n`evaluate_action_policy()` is the sole authority for static role, stage, tier, review-scope, gate, effect, and capability admissibility. Workflow metadata is a workflow-specific contract inventory, not the complete admissible set, a required sequence, or a lifecycle matrix. Every declared value must remain admissible under that evaluator; metadata never grants permission or makes an otherwise-invalid combination valid.\n\nImplementation role/tier floors are:\n\n| Execution class | Risk | Minimum role | Minimum tier |\n| --- | --- | --- | --- |\n| mechanical | any | mechanic | cheap |\n| prescriptive | low or medium | implementer-lite | cheap |\n| prescriptive | high | implementer | standard |\n| bounded | any | implementer | standard |\n\nNon-high-risk prescriptive work uses `implementer-lite` at `cheap`; high-risk prescriptive work uses `implementer` at `standard`.\n\nA `design` stage uses `architect` at `high`; `research` uses `researcher` at `standard`; `review` and `final` use `reviewer` at `high`. A bounded-delegate assignment must preserve the assigned role's corresponding tier floor. A role or tier may be strengthened, never weakened below its floor. These are logical roles and tiers, not provider, model, or harness choices.\n\nDispatch only an admissible role, stage, tier, effect, and capability combination under static core policy. Repository writes require enforced write capability; unknown or advisory capability is insufficient. External-write and destructive effects remain unsupported absent a separately approved safe protocol.\n\nThe controller is the single writer. For durable work, persist a stable operation ID, exact request, and `dispatch-uncertain` state before invoking an adapter. A missing receipt does not prove dispatch did not occur. Never repeat an unresolved op